{
  "$schema": "https://raw.githubusercontent.com/username/code-survey/main/schema.json",
  "externalImports": {
    "web-tree-sitter": [
      "src/parsers/csharp.ts",
      "src/parsers/go.ts",
      "src/parsers/java.ts",
      "src/parsers/javascript.ts",
      "src/parsers/python.ts",
      "src/parsers/rust.ts",
      "src/parsers/typescript.ts"
    ],
    "yaml": [
      "src/writer.ts",
      "tests/integration.test.ts",
      "tests/writer.test.ts"
    ]
  },
  "files": {
    "src/index.ts": {
      "exports": [
        {
          "location": "Ln 22-37",
          "name": "CodeSurveyOptions",
          "type": "type"
        },
        {
          "location": "Ln 62-368",
          "name": "createCodeSurvey",
          "type": "function"
        }
      ],
      "hash": "a5b15e218895e1c803187726c06d124a11d186a0af754486b736a5e678230c6e",
      "imports": [
        {
          "source": "./parser.ts",
          "symbols": [
            "CodebaseParser",
            "parsePackageDependencies"
          ]
        },
        {
          "source": "./resolver.ts",
          "symbols": [
            "resolveImports"
          ]
        },
        {
          "source": "./scanner.ts",
          "symbols": [
            "scanDirectory"
          ]
        },
        {
          "source": "./types.ts",
          "symbols": [
            "CodeSurveyResult",
            "CodeSurveySchema",
            "FileEntry",
            "NamespaceEntry",
            "SymbolEntry"
          ]
        },
        {
          "source": "./writer.ts",
          "symbols": [
            "generateDependenciesMarkdown",
            "generateDeterministicJson",
            "generateDeterministicMarkdown",
            "generateDeterministicMermaid",
            "generateDeterministicYaml",
            "generateFilesMarkdown",
            "generateLinksMarkdown",
            "generateNamespacesMarkdown",
            "generateProjectMarkdown"
          ]
        },
        {
          "source": "node:child_process",
          "symbols": [
            "execSync"
          ]
        },
        {
          "source": "node:crypto",
          "symbols": [
            "crypto"
          ]
        },
        {
          "source": "node:fs",
          "symbols": [
            "fs"
          ]
        },
        {
          "source": "node:os",
          "symbols": [
            "os"
          ]
        },
        {
          "source": "node:path",
          "symbols": [
            "path"
          ]
        }
      ],
      "symbols": [
        {
          "location": "Ln 39-60",
          "name": "getGitChangedFiles",
          "type": "function"
        }
      ]
    },
    "src/parser.ts": {
      "exports": [
        {
          "location": "Ln 150-194",
          "name": "CodebaseParser",
          "type": "class"
        },
        {
          "location": "Ln 15-146",
          "name": "parsePackageDependencies",
          "type": "function"
        }
      ],
      "hash": "d5608f905392101a6f30da95366a247f13db0e0ba9f0fa5c0df2e6080fc9b70b",
      "imports": [
        {
          "source": "./parsers/csharp.ts",
          "symbols": [
            "CSharpParser"
          ]
        },
        {
          "source": "./parsers/go.ts",
          "symbols": [
            "GoParser"
          ]
        },
        {
          "source": "./parsers/java.ts",
          "symbols": [
            "JavaParser"
          ]
        },
        {
          "source": "./parsers/javascript.ts",
          "symbols": [
            "JavaScriptParser"
          ]
        },
        {
          "source": "./parsers/python.ts",
          "symbols": [
            "PythonParser"
          ]
        },
        {
          "source": "./parsers/rust.ts",
          "symbols": [
            "RustParser"
          ]
        },
        {
          "source": "./parsers/typescript.ts",
          "symbols": [
            "TypeScriptParser"
          ]
        },
        {
          "source": "./types.ts",
          "symbols": [
            "LanguageParser",
            "PackageDependencies",
            "ParseOptions",
            "ParseResult"
          ]
        },
        {
          "source": "./utils/wasm-loader.ts",
          "symbols": [
            "getWasmPath"
          ]
        },
        {
          "source": "node:fs",
          "symbols": [
            "fs"
          ]
        },
        {
          "source": "node:path",
          "symbols": [
            "path"
          ]
        }
      ],
      "symbols": []
    },
    "src/parsers/csharp.ts": {
      "exports": [
        {
          "location": "Ln 19-144",
          "name": "CSharpParser",
          "type": "class"
        }
      ],
      "hash": "5529207c240ced31f291a7bd71c4660a1933a41f4415867ee3f16bd472d1f09a",
      "imports": [
        {
          "source": "../types.ts",
          "symbols": [
            "ImportEntry",
            "LanguageParser",
            "ParseOptions",
            "ParseResult",
            "SymbolEntry"
          ]
        },
        {
          "source": "../types.ts",
          "symbols": [
            "formatDocstring",
            "formatLocation"
          ]
        },
        {
          "source": "web-tree-sitter",
          "symbols": [
            "Parser"
          ]
        }
      ],
      "symbols": [
        {
          "location": "Ln 7-12",
          "name": "ensureParserInit",
          "type": "function"
        },
        {
          "location": "Ln 14-17",
          "name": "isCSharpPublic",
          "type": "function"
        },
        {
          "location": "Ln 5",
          "name": "isParserInitialized",
          "type": "variable"
        }
      ]
    },
    "src/parsers/go.ts": {
      "exports": [
        {
          "location": "Ln 21-162",
          "name": "GoParser",
          "type": "class"
        }
      ],
      "hash": "34e6b8ee8a576afc6eb9df2a3c77fd2097502ef3f7a7ac0c59b882dd5614bf47",
      "imports": [
        {
          "source": "../types.ts",
          "symbols": [
            "ImportEntry",
            "LanguageParser",
            "ParseOptions",
            "ParseResult",
            "SymbolEntry"
          ]
        },
        {
          "source": "../types.ts",
          "symbols": [
            "formatDocstring",
            "formatLocation"
          ]
        },
        {
          "source": "web-tree-sitter",
          "symbols": [
            "Parser"
          ]
        }
      ],
      "symbols": [
        {
          "location": "Ln 7-12",
          "name": "ensureParserInit",
          "type": "function"
        },
        {
          "location": "Ln 14-19",
          "name": "isGoExported",
          "type": "function"
        },
        {
          "location": "Ln 5",
          "name": "isParserInitialized",
          "type": "variable"
        }
      ]
    },
    "src/parsers/java.ts": {
      "exports": [
        {
          "location": "Ln 22-134",
          "name": "JavaParser",
          "type": "class"
        }
      ],
      "hash": "34dc5d598bcadaf2046e7d4978c4f71ecb3d88e800ff247aba310f46c600ca24",
      "imports": [
        {
          "source": "../types.ts",
          "symbols": [
            "ImportEntry",
            "LanguageParser",
            "ParseOptions",
            "ParseResult",
            "SymbolEntry"
          ]
        },
        {
          "source": "../types.ts",
          "symbols": [
            "formatDocstring",
            "formatLocation"
          ]
        },
        {
          "source": "web-tree-sitter",
          "symbols": [
            "Parser"
          ]
        }
      ],
      "symbols": [
        {
          "location": "Ln 7-12",
          "name": "ensureParserInit",
          "type": "function"
        },
        {
          "location": "Ln 14-20",
          "name": "isJavaPublic",
          "type": "function"
        },
        {
          "location": "Ln 5",
          "name": "isParserInitialized",
          "type": "variable"
        }
      ]
    },
    "src/parsers/javascript.ts": {
      "exports": [
        {
          "location": "Ln 14-174",
          "name": "JavaScriptParser",
          "type": "class"
        }
      ],
      "hash": "f58f254e21ad5172e959cd0a4abfec56fa39c6102c768e6d94e12632626a9713",
      "imports": [
        {
          "source": "../types.ts",
          "symbols": [
            "ImportEntry",
            "LanguageParser",
            "ParseOptions",
            "ParseResult",
            "SymbolEntry"
          ]
        },
        {
          "source": "../types.ts",
          "symbols": [
            "formatDocstring",
            "formatLocation"
          ]
        },
        {
          "source": "web-tree-sitter",
          "symbols": [
            "Parser"
          ]
        }
      ],
      "symbols": [
        {
          "location": "Ln 7-12",
          "name": "ensureParserInit",
          "type": "function"
        },
        {
          "location": "Ln 5",
          "name": "isParserInitialized",
          "type": "variable"
        }
      ]
    },
    "src/parsers/python.ts": {
      "exports": [
        {
          "location": "Ln 14-155",
          "name": "PythonParser",
          "type": "class"
        }
      ],
      "hash": "40f9436b88269c51a3c6e53e819ffd1c5af6dfd56f32086ef223cbb2e810d54c",
      "imports": [
        {
          "source": "../types.ts",
          "symbols": [
            "ImportEntry",
            "LanguageParser",
            "ParseOptions",
            "ParseResult",
            "SymbolEntry"
          ]
        },
        {
          "source": "../types.ts",
          "symbols": [
            "formatDocstring",
            "formatLocation"
          ]
        },
        {
          "source": "web-tree-sitter",
          "symbols": [
            "Parser"
          ]
        }
      ],
      "symbols": [
        {
          "location": "Ln 7-12",